{
  "schema_id": "climateos.cooma_official_source_metadata.v0.1",
  "pilot": {
    "base_main_sha": "708aa9f5231e52aea85f4d280214070618ef1c52",
    "place_name": "Cooma",
    "accessed_on": "2026-07-17",
    "mode": "PUBLIC_OFFICIAL_HTML_METADATA_ONLY",
    "purpose": "SOURCE_IDENTITY_VERSION_SCOPE_AND_REUSE_BOUNDARY"
  },
  "source_tiers": [
    "STATUTORY_PRIMARY",
    "STATE_GOVERNMENT_PRIMARY",
    "COUNCIL_PRIMARY",
    "PROJECT_PROPONENT_PRIMARY",
    "SCIENTIFIC_AGENCY_PRIMARY",
    "OFFICIAL_NEWS_DISCOVERY"
  ],
  "records": [
    {
      "source_id": "COOMA-SRC-001",
      "title": "Cooma-Monaro Shire Development Control Plan",
      "publisher": "Snowy Monaro Regional Council",
      "tier": "COUNCIL_PRIMARY",
      "source_kind": "PLANNING_CONTROL_LANDING",
      "canonical_url": "https://www.snowymonaro.nsw.gov.au/Building-and-Planning/Development/Planning-Controls/Development-Control-Plans/Cooma-Monaro-Shire-Development-Control-Plan",
      "domain": "snowymonaro.nsw.gov.au",
      "accessed_on": "2026-07-17",
      "page_format": "HTML",
      "identity_status": "VERIFIED_PUBLIC_PAGE",
      "visible_date": null,
      "version_state": "LANDING_PAGE_IDENTIFIES_DCP_DOCUMENT_DOCUMENT_VERSION_NOT_DOWNLOADED",
      "geography_scope": "Former Cooma-Monaro local government area as declared by the page",
      "geographic_relevance": "FORMER_COOMA_MONARO",
      "retained_metadata_fields": ["TITLE", "PUBLISHER", "CANONICAL_URL", "VISIBLE_DATE_OR_VERSION", "DECLARED_GEOGRAPHY", "ACCESS_DATE", "ADMISSION_STATE"],
      "licence_state": "NOT_ASSESSED_REFERENCE_ONLY",
      "reuse_permission": "NOT_CLAIMED",
      "raw_content_retained": false,
      "file_downloaded": false,
      "dataset_downloaded": false,
      "admission_state": "METADATA_ADMITTED_REFERENCE_ONLY",
      "claim_boundary": "Identifies the Council landing page for the Cooma-Monaro DCP family.",
      "does_not_prove": ["CURRENT_DOCUMENT_TEXT", "SITE_APPLICABILITY", "PLANNING_INTERPRETATION", "COUNCIL_DATABASE_COMPLETENESS"],
      "human_review_required": true
    },
    {
      "source_id": "COOMA-SRC-002",
      "title": "Cooma-Monaro Local Environmental Plan 2013",
      "publisher": "NSW legislation",
      "tier": "STATUTORY_PRIMARY",
      "source_kind": "STATUTORY_INSTRUMENT",
      "canonical_url": "https://legislation.nsw.gov.au/view/html/inforce/current/epi-2013-0614",
      "domain": "legislation.nsw.gov.au",
      "accessed_on": "2026-07-17",
      "page_format": "HTML",
      "identity_status": "VERIFIED_PUBLIC_PAGE",
      "visible_date": "Current version shown for 19 October 2025 to date",
      "version_state": "CURRENT_IN_FORCE_PAGE_VISIBLE_AT_ACCESS_TIME_POINT_IN_TIME_RECHECK_REQUIRED",
      "geography_scope": "Land to which the Cooma-Monaro Local Environmental Plan 2013 applies",
      "geographic_relevance": "FORMER_COOMA_MONARO",
      "retained_metadata_fields": ["TITLE", "PUBLISHER", "CANONICAL_URL", "VISIBLE_DATE_OR_VERSION", "DECLARED_GEOGRAPHY", "ACCESS_DATE", "ADMISSION_STATE"],
      "licence_state": "NOT_ASSESSED_REFERENCE_ONLY",
      "reuse_permission": "NOT_CLAIMED",
      "raw_content_retained": false,
      "file_downloaded": false,
      "dataset_downloaded": false,
      "admission_state": "METADATA_ADMITTED_REFERENCE_ONLY",
      "claim_boundary": "Identifies the official in-force legislation page and visible version state at access time.",
      "does_not_prove": ["PARCEL_APPLICABILITY", "LEGAL_INTERPRETATION", "DEVELOPMENT_APPROVAL_OUTCOME", "FUTURE_VERSION_STATE"],
      "human_review_required": true
    },
    {
      "source_id": "COOMA-SRC-003",
      "title": "South East and Tablelands",
      "publisher": "NSW Planning",
      "tier": "STATE_GOVERNMENT_PRIMARY",
      "source_kind": "REGIONAL_PLAN_LANDING",
      "canonical_url": "https://www.planning.nsw.gov.au/plans-for-your-area/regional-plans/south-east-and-tablelands",
      "domain": "planning.nsw.gov.au",
      "accessed_on": "2026-07-17",
      "page_format": "HTML",
      "identity_status": "VERIFIED_PUBLIC_PAGE",
      "visible_date": null,
      "version_state": "PAGE_SHOWS_2036_PLAN_AND_DRAFT_2041_REVIEW_TRANSITION",
      "geography_scope": "South East and Tablelands region",
      "geographic_relevance": "SOUTH_EAST_TABLELANDS_REGION",
      "retained_metadata_fields": ["TITLE", "PUBLISHER", "CANONICAL_URL", "VISIBLE_DATE_OR_VERSION", "DECLARED_GEOGRAPHY", "ACCESS_DATE", "ADMISSION_STATE"],
      "licence_state": "NOT_ASSESSED_REFERENCE_ONLY",
      "reuse_permission": "NOT_CLAIMED",
      "raw_content_retained": false,
      "file_downloaded": false,
      "dataset_downloaded": false,
      "admission_state": "METADATA_ADMITTED_REFERENCE_ONLY",
      "claim_boundary": "Identifies the official regional-plan landing page and a visible plan-review transition.",
      "does_not_prove": ["FINAL_2041_PLAN_STATUS", "COOMA_LOCAL_OUTCOME", "IMPLEMENTATION_COMPLETENESS", "PROJECT_DECISION"],
      "human_review_required": true
    },
    {
      "source_id": "COOMA-SRC-004",
      "title": "Delivering the South East and Tablelands Plan 2036",
      "publisher": "NSW Planning",
      "tier": "STATE_GOVERNMENT_PRIMARY",
      "source_kind": "REGIONAL_PLAN_DELIVERY",
      "canonical_url": "https://www.planning.nsw.gov.au/plans-in-nsw/regional-plans/south-east-and-tablelands/delivering-the-south-east-and-tablelands-plan-2036",
      "domain": "planning.nsw.gov.au",
      "accessed_on": "2026-07-17",
      "page_format": "HTML",
      "identity_status": "VERIFIED_PUBLIC_PAGE",
      "visible_date": null,
      "version_state": "2036_IMPLEMENTATION_PAGE_STATES_PLAN_UNDER_REVIEW_TO_2041",
      "geography_scope": "Nine listed South East and Tablelands local government areas including Snowy Monaro",
      "geographic_relevance": "SOUTH_EAST_TABLELANDS_REGION",
      "retained_metadata_fields": ["TITLE", "PUBLISHER", "CANONICAL_URL", "VISIBLE_DATE_OR_VERSION", "DECLARED_GEOGRAPHY", "ACCESS_DATE", "ADMISSION_STATE"],
      "licence_state": "NOT_ASSESSED_REFERENCE_ONLY",
      "reuse_permission": "NOT_CLAIMED",
      "raw_content_retained": false,
      "file_downloaded": false,
      "dataset_downloaded": false,
      "admission_state": "METADATA_ADMITTED_REFERENCE_ONLY",
      "claim_boundary": "Identifies the official implementation landing page and declared regional coverage.",
      "does_not_prove": ["COOMA_ACTION_DELIVERY", "CURRENT_PROJECT_PROGRESS", "LOCAL_ENVIRONMENTAL_EFFECT", "DATABASE_COMPLETENESS"],
      "human_review_required": true
    },
    {
      "source_id": "COOMA-SRC-005",
      "title": "Water and Wastewater",
      "publisher": "Snowy Monaro Regional Council",
      "tier": "COUNCIL_PRIMARY",
      "source_kind": "COUNCIL_SERVICE_LANDING",
      "canonical_url": "https://www.snowymonaro.nsw.gov.au/Water-and-Wastewater",
      "domain": "snowymonaro.nsw.gov.au",
      "accessed_on": "2026-07-17",
      "page_format": "HTML",
      "identity_status": "VERIFIED_PUBLIC_PAGE",
      "visible_date": null,
      "version_state": "NO_VISIBLE_PUBLICATION_OR_REVISION_DATE_CAPTURED",
      "geography_scope": "Snowy Monaro Regional Council water and wastewater service context",
      "geographic_relevance": "SNOWY_MONARO_LGA",
      "retained_metadata_fields": ["TITLE", "PUBLISHER", "CANONICAL_URL", "VISIBLE_DATE_OR_VERSION", "DECLARED_GEOGRAPHY", "ACCESS_DATE", "ADMISSION_STATE"],
      "licence_state": "NOT_ASSESSED_REFERENCE_ONLY",
      "reuse_permission": "NOT_CLAIMED",
      "raw_content_retained": false,
      "file_downloaded": false,
      "dataset_downloaded": false,
      "admission_state": "METADATA_ADMITTED_REFERENCE_ONLY",
      "claim_boundary": "Identifies the Council service landing page and its public navigation scope.",
      "does_not_prove": ["ASSET_REGISTER_COMPLETENESS", "CURRENT_ASSET_CONDITION", "WORKSITE_STATE", "COMPLIANCE_OUTCOME"],
      "human_review_required": true
    },
    {
      "source_id": "COOMA-SRC-006",
      "title": "Where Does My Water Come From?",
      "publisher": "Snowy Monaro Regional Council",
      "tier": "COUNCIL_PRIMARY",
      "source_kind": "COUNCIL_WATER_SOURCE_LANDING",
      "canonical_url": "https://www.snowymonaro.nsw.gov.au/Water-and-Wastewater/Water-Supply/Where-Does-My-Water-Come-From",
      "domain": "snowymonaro.nsw.gov.au",
      "accessed_on": "2026-07-17",
      "page_format": "HTML",
      "identity_status": "VERIFIED_PUBLIC_PAGE",
      "visible_date": null,
      "version_state": "NO_VISIBLE_PUBLICATION_OR_REVISION_DATE_CAPTURED",
      "geography_scope": "Council-declared town water-source overview including Cooma",
      "geographic_relevance": "DIRECT_COOMA",
      "retained_metadata_fields": ["TITLE", "PUBLISHER", "CANONICAL_URL", "VISIBLE_DATE_OR_VERSION", "DECLARED_GEOGRAPHY", "ACCESS_DATE", "ADMISSION_STATE"],
      "licence_state": "NOT_ASSESSED_REFERENCE_ONLY",
      "reuse_permission": "NOT_CLAIMED",
      "raw_content_retained": false,
      "file_downloaded": false,
      "dataset_downloaded": false,
      "admission_state": "METADATA_ADMITTED_REFERENCE_ONLY",
      "claim_boundary": "Identifies the public Council page for its declared town water-source overview.",
      "does_not_prove": ["CURRENT_WATER_QUALITY", "CURRENT_FLOW_OR_CAPACITY", "CATCHMENT_CONDITION", "OPERATIONAL_INSTRUCTION"],
      "human_review_required": true
    },
    {
      "source_id": "COOMA-SRC-007",
      "title": "Climate statistics for Australian locations — Cooma Airport AWS",
      "publisher": "Australian Bureau of Meteorology",
      "tier": "SCIENTIFIC_AGENCY_PRIMARY",
      "source_kind": "STATION_METADATA",
      "canonical_url": "https://www.bom.gov.au/climate/averages/tables/cw_070217.shtml",
      "domain": "bom.gov.au",
      "accessed_on": "2026-07-17",
      "page_format": "HTML",
      "identity_status": "VERIFIED_PUBLIC_PAGE",
      "visible_date": "Latest available data shown as 05 February 2026",